skill_code	skill_name	skill_short_name	camp_code	disp_order	description
VILLAGER	村人	村	VILLAGER	1	あなたは村人です。特別な能力はありません。
SEER	占い師	占	VILLAGER	2	あなたは占い師です。毎晩一人を占い、人狼かどうかを知ることができます。
MEDIUM	霊能者	霊	VILLAGER	3	あなたは霊能者です。処刑された・突然死した人物が人狼であったかどうかを知ることができます。
HUNTER	狩人	狩	VILLAGER	4	あなたは狩人です。初日以外の毎晩、自分以外の一人を人狼の襲撃から守ることができます。
WEREWOLF	人狼	狼	WEREWOLF	5	あなたは人狼です。人狼系役職とC国狂人同士にしか聞こえない会話が可能です。また、毎晩一人を襲撃することができます。
MADMAN	狂人	狂	WEREWOLF	6	あなたは狂人です。特別な能力はありませんが、人狼の勝利があなたの勝利となります。
LEFTOVER	おまかせ	お	VILLAGER	7	余った役職が割り当てられます。